Column 1,Column 2,Column 3,Column 4,Column 5,Column 6
1,CC/1600/2024,RAPOLU BHASKAR,,NALGONDA,
2,CC/1603/2024,PASHAM SRINIVASULU,,JAGTIAL,
3,CC/1615/2024,C SUNITHA KUMARI,,JANGAON,
4,CC/1620/2024,SOMAVARAPU SATYANARAYANA,,MAHABUBABAD,
5,CC/1658/2024,BOMMINENI VIVEKANANDA,,HYDERABAD,
6,CC/1665/2024,KRISHNA KISHORE KOVVURI,,ADILABAD,
7,CRP/2556/2024IA,VSRMV PRASAD SANAKA,,NAGARKURNOOL,
8,CRP/2558/2024,R DHEERAJ SINGH,,NAGARKURNOOL,
9,CRP/2582/2024IA,K SREENIVAS,N BHUJANGA RAO,NAGARKURNOOL,
10,CRP/2601/2024IA,J SURESH BABU,P GIRI KRISHNA,NAGARKURNOOL,
11,CRP/2603/2024IA,S KESHAVA RAO,,NAGARKURNOOL,
12,CRP/2632/2024IA,K SREENIVAS,N BHUJANGA RAO,NAGARKURNOOL,
13,WP/23177/2024IA,PASHAM MOHITH,GP FOR CIVIL SUPPLIES,SURYAPET,
14,WP/23212/2024IA,K VENUMADHAV,GP FOR CIVIL SUPPLIESGP FOR HOME (R3),HANUMAKONDA,
15,WP/23226/2024IA,LAXMAIAH KANCHANI,GP FOR CIVIL SUPPLIESGP FOR HOME (R5),SIDDIPET,
16,WP/23238/2024IA,LAXMAIAH KANCHANI,GP FOR CIVIL SUPPLIESGP FOR HOME (R5),SIDDIPET,
17,WP/23210/2024IA,M V PRAVEEN KUMAR,GP FOR COOPERATION,HYDERABAD,
18,WP/23153/2024IA,USAKOYEELA CHANDRASHEKAR,GP FOR PANCHAYAT RAJ   RURAL DEV,KAMAREDDY,
19,WP/23227/2024IA,P KRISHNA MOHAN,GP FOR PANCHAYAT RAJ   RURAL DEVGP FOR REVENUE (R2),RANGA REDDY,
20,WP/22446/2024IA,VADLAKONDA KIRAN KUMAR,GP FOR CIVIL SUPPLIESGP FOR HOME (R4),MAHABUBABAD,
21,WP/22502/2024IA,PRAMOD MALIGI,GP FOR CIVIL SUPPLIES,MEDCHAL-MALKAJGIRI,
22,WP/22706/2024IA,K DURGA PRASAD,GP FOR CIVIL SUPPLIES,NIZAMABAD,
23,WP/22398/2024IA,PRAVEEN BONKURI,GP FOR COOPERATION,HYDERABAD,
24,CRP/1959/2024IA,R MANGULAL,"A SRINIVAS (R2)A. SRINIVAS, COUNSEL FOR R2",ADILABAD,
25,CC/1597/2017IA,KISHORE RAO PUSKURU (SC FOR TS ZILLA PARISHADS),BODA RAKESH NAIKP PADMA RAO (R194)MD FAROOQ ALI (R193),NIZAMABAD,
26,WP/32577/2016IA,MOHD FAROOQ ALI,GP FOR PANCHAYAT RAJ   RURAL DEVG NARENDER REDDY(SC FORTG ZPP MPP GPPS) (R16),NIZAMABAD,
27,CC/2146/2023IA,SRINIVASA RAO  MADIRAJU,GP FOR SERVICES IADDL ADVOCATE GENERAL (R2)SR- Notice served.,MAHABUBNAGAR,
28,CC/58/2024IA,K UDAYA SRI,"K RAM MURTHYGP FOR SERVICES I (R2)GP FOR SERVICES I (R3)Order Dated 12.07.2024.  RR 1 to 3 notice sent by RPAD not yet returned served.  Notice sent to The commissioner of Police, Hyderabad City, Hyderabad by special messenger. Non bailable warrant not executed.",HYDERABAD,
29,WP/1025/2024IA,A ANASUYA,GP FOR PANCHAYAT RAJ   RURAL DEV,NAGARKURNOOL,
30,WP/19313/2024IA,HARI KISHAN KUDIKALA,GP FOR AGRICULTURES PRAMOD KUMAR (R3),MEDAK,
31,CC/567/2022IA,R NARASIMHA REDDY,ADDL ADVOCATE GENERALGP FOR AGRICULTURE (R3)RR 1 to 3 notice served.,MEDAK,
32,CC/292/2022IA,R NARASIMHA REDDY,"ADDL ADVOCATE GENERALOrder Dated 12.07.2024.  CC 292 and 567/22.  RR 1 and 2 notice sent through Chief Judge, city civil court, Hyderabad and by RPAD. R 3 notice sent through DJ, Sangareddy District at Sangareddy and by RPAD not yet returned served.",MEDAK,
33,CC/1901/2023IA,SRINIVASA RAO  MADIRAJU,GP FOR SERVICES IOrder Dated 28.06.2024.  RR 1 to 3 notice sent by RPAD not yet returned served.,JOGULAMBA GADWAL,
34,CC/2298/2023CC/2299/2023CC/2300/2023,AVADESH NARAYAN SANGHI,Government Pleader for Services (Home) (R2)RR 1 & 2- Notice served.,NALGONDA,
35,CC/2299/2023,AVADESH NARAYAN SANGHI,Government Pleader for Services (Home) (R2)RR 1 & 2- Notice served.,MEDCHAL-MALKAJGIRI,
36,CC/2300/2023,AVADESH NARAYAN SANGHI,Government Pleader for Services (Home) (R2)RR 1 & 2- Notice served.,MEDCHAL-MALKAJGIRI,
37,CC/2793/2023,D LINGA RAO,GP FOR SERVICES III,NIZAMABAD,
38,CC/369/2024,P VENKATESWAR RAO,K RAVINDER REDDY (SC FOR GHMC) (R2),HYDERABAD,
39,CC/826/2024,G RAVINDAR,ADDL ADVOCATE GENERALOrder Dated 26.07.2024.   RR 1 to 3 notice sent by RPAD not yet returned.,HYDERABAD,
40,CC/1520/2024IA,JOGRAM TEJAVAT,,HYDERABAD,
41,CC/2334/2015IA,N PRAMOD,"G NARENDER REDDY(SC FORTG ZPP MPP GPPS)ADDL ADVOCATE GENERAL (R27)GP FOR PANCHAYAT RAJ   RURAL DEV (R28)R 3 notice sent through the dist judge karimnagar dist at karimnagar snf by rpad not yet retd served.
 WP.37703/2015",KARIMNAGAR,
42,WP/37703/2015IA,N PRAMOD,GP FOR PANCHAYAT RAJ   RURAL DEVGP FOR REVENUE (R11)KANDI RAMCHANDRA REDDY (R12)ADDL ADVOCATE GENERAL (R10)G NARENDER REDDY(SC FORTG ZPP MPP GPPS) (R13),KARIMNAGAR,
43,CC/50/2020,M PRATHEEK REDDY,GP FOR REVENUEKISHORE RAO PUSKURU (SC FOR TS ZILLA PARISHADS) (R2)KISHORE RAO PUSKURU (SC FOR TS ZILLA PARISHADS) (R3)KISHORE RAO PUSKURU (SC FOR TS ZILLA PARISHADS) (R4)G RAVI CHANDRA SEKHAR (R5),KHAMMAM,
44,CC/491/2022IA,CH SRINIVASA RAJU,KISHORE RAO PUSKURU (SC FOR TS ZILLA PARISHADS)GP FOR PANCHAYAT RAJ   RURAL DEV (R2),NIZAMABAD,
45,WP/37839/2022IA,G ANANDAMSHRESTH AGARWAL,GP FOR PANCHAYAT RAJ   RURAL DEVVIJAY PISSAY (R9)M RAM GOPAL RAO(STANDING COUNSEL FOR ZPPS AND MPPS AND GPSS) (R4)V NARASIMHA GOUD(SC FOR HMDA) (R2)VIJAY PISSAYVIJAY PISSAY (R11)VIJAY PISSAY (R12),MEDAK,
46,CC/610/2024IA,VIJAY PISSAY,SHRESTH AGARWALV NARASIMHA GOUD(SC FOR HMDA) (R2)R CHANDRA SHEKAR REDDY (SC FOR TS ZILLA PARISHADS) (R4),MEDAK,
47,CC/1109/2023IA,K SRINIVASA PRASAD,GP FOR SERVICES I,NIZAMABAD,
48,CC/1145/2023IA,P LAKSHMANA RAO,GP FOR SERVICES IGP FOR SERVICES II (R4)RR 1 to 3- Notice served.,HYDERABAD,
49,CC/1412/2023WP/35189/2022,PAIDI DHANA LAKSHMI SRAVAN REDDY,R CHANDRA SHEKAR REDDY (SC FOR TS ZILLA PARISHADS),KAMAREDDY,
50,WP/35189/2022IA,D SATYANARAYANA,GP FOR PANCHAYAT RAJ   RURAL DEVGP FOR REVENUE (R2)BHARGAVAKRISHNA.LM RAM GOPAL RAO(STANDING COUNSEL FOR ZPPS AND MPPS AND GPSS) (R3)SURYA BALU MAHENDRA (R8)R CHANDRA SHEKAR REDDY (SC FOR TS ZILLA PARISHADS) (R6),KAMAREDDY,
51,CC/1540/2023IA,NAYAKAWADI RAMESH,GP FOR SERVICES IIIM MURALI KRISHNA (R2),NIZAMABAD,
52,CC/1970/2023WP/6930/2020,B SUDHAKAR REDDY AND NEERAJA REDDY,GP FOR SERVICES II,ADILABAD,
53,WP/6930/2020IA,B SUDHAKAR REDDY AND NEERAJA REDDY,GP FOR REVENUEGUNDRATI RAMAN GOUD (R3)PASHAM SUJATHA (SC FOR SATAVAHANA UNIVERSITYKARIMNAGAR) (R4)NULL,ADILABAD,
54,CC/2439/2023,P RATNAM,GP FOR SERVICES IIM RAMGOPAL RAO (SC FOR TSPSC) (R2),HYDERABAD,
55,CC/2725/2023IA,KALLEPALLI THIRUMALA RAO,P SRI HARSHA REDDY (SC FOR SINGARENI COLLIERIES CO LTD),MANCHERIAL,
56,EP/12/2024IA,ANI RUDH N,"MOHAMMED OMER FAROOQR GIRI KUMAR (R5)R GIRI KUMARRR1,3&4-Apps by Mohd.Omer Farooq
 R2-Notice Served through CJ-City Civil court,Hyd
 R5-Apps by Sri.R Giri Kumar
 RR6,14-Notice sent by RPAD Acknowledments received without signatures & through DJ-Adilabad district court not yet returned 
 RR7,8,10,11,13-Notice Served through JCJCourt,Utnoor,Adilabad District
 R9-Notice sent by RPAD returned unserved as ""No Such Person In this Address""
 R12-Notice sent by RPAD & through District Court not yet returned
 RR 6,9,12,14-Memo Proof of Paper Publication filed vide USR Nos.73637/24 & 73649/24",NIRMAL,
57,CC/455/2024,P PADMA RAO,GP FOR SERVICES I,HYDERABAD,
58,CC/541/2024,KIRTHI TEJA KONDAVEETI,GP FOR SERVICES III,HYDERABAD,
59,CC/706/2024IA,PULLA RAO YELLANKI,GP FOR SERVICES I,BHADRADRI KOTHAGUDEM,
60,CC/928/2024,RAMESH BURA,GP FOR REVENUE,HANUMAKONDA,
61,CC/991/2024,ERIGI GANESH,,RAJANNA SIRCILLA,
62,CC/1142/2024,ARVIND KUMAR KATA,GP FOR SERVICES II,KARIMNAGAR,
63,CC/1154/2024,ALLURI DIVAKAR REDDY,GP FOR PANCHAYAT RAJ   RURAL DEVKISHORE RAO PUSKURU (SC FOR TS ZILLA PARISHADS) (R3)KISHORE RAO PUSKURU (SC FOR TS ZILLA PARISHADS) (R4),JANGAON,
64,CC/1254/2024,ALLURI DIVAKAR REDDY,R CHANDRA SHEKAR REDDY (SC FOR TS ZILLA PARISHADS) (R3)GP FOR PANCHAYAT RAJ   RURAL DEV (R2),JAGTIAL,
65,CC/1261/2024IA,S RAM BABU,GP FOR FINANCE   PLANNING,YADADRI BHUVANAGIRI,
66,CRP/1303/2024IA,L HARISH,"NAVEEN KUMAR VRR1 TO 3 APP BY M/S. V.NAVEEN KUMAR, ADVOCATE. RR4 AND 6 RECEIVED. MEMO PROOF OF SERVICE FILED VIDE USR.NO. 61131/2024. RR5, 7, 8, 9 NOTICE SENT, NOT YET RETURNED. PROOF OF SERVICE NOT FILED.",NAGARKURNOOL,
67,CRP/1313/2024,L HARISH,"NAVEEN KUMAR VRR1 TO 3 APP BY M/S. V.NAVEEN KUMAR, ADVOCATE. RR4 AND 6 SERVED. MEMO PROOF OF SERVICE FILED VIDE USR.NO. 61134/2024. RR5, 7 TO 14 NOTICE SENT, NOT YET RETURNED.",NAGARKURNOOL,
68,CC/1322/2024IA,MOHD BASEER RIYAZ,M V KINI CO ADVOCATES SOLICITORS,KAMAREDDY,
69,CC/1327/2024IA,MOHD BASEER RIYAZ,M V KINI CO ADVOCATES SOLICITORS,KAMAREDDY,
70,CRP/1366/2024IA,SRINIVAS VELAGAPUDI,JILLELLA RAJESWARA RAORR-1TO5 APP BY JILLELA RAJESWARA RAO.R6-SERVED.AS PER MEMO FILED ALONG WITH TRACK REPORT IS ENCLOSED.VIDE USR NO.45843/24.,NAGARKURNOOL,
71,CC/1396/2024,NARESH KUMAR GORIGE,K RAVINDER REDDY (SC FOR GHMC) (R3)K RAVINDER REDDY (SC FOR GHMC) (R4),HYDERABAD,
72,CC/1431/2024,P VENUGOPAL REDDY .. TMP,GP FOR SERVICES I (R3),JAGTIAL,
73,CC/1436/2024,T SRUJAN KUMAR REDDY,GP FOR LAND ACQUISITION,KAMAREDDY,
74,CC/1437/2024,T SRUJAN KUMAR REDDY,GP FOR LAND ACQUISITION,KAMAREDDY,
75,CC/1440/2024,VENKATARAMANAIAH K,GP FOR REVENUE,SANGAREDDY,
76,CRP/1527/2024,M DAMODAR REDDY,N BHUJANGA RAOSR-APP BY N.BHUJANGA RAO.,NAGARKURNOOL,
77,CRP/1658/2024IA,J SURESH BABU,D AMARENDER REDDYRR-1TO5 NOTICE SENT NOT YET RETD.RR-6TO10 ARE NOT NECASSARY PARTIES.PROOF OF SERVICE NOT FILED.,NAGARKURNOOL,
78,CRP/1680/2024IA,K SREENIVAS,R1-DIED AS PER PROPOSED LRS RR 12 TO 15 MEMO FILED VIDE USR NO.64125/24.RR2TO11 ARE NOT NECESSARY PARTIES.,NAGARKURNOOL,
79,CRP/1697/2024IA,K SREENIVAS,"VIJAY B PAROPAKARIRR 1, 2 DIED VIDE CT
 RR 3 TO 5 NOTICE SENT NOT YET RETURNED
 PROOF OF SERVICE NOT FILED",NAGARKURNOOL,
80,CRP/1945/2024IA,M DAMODAR REDDY,SR-RETURNED UNSERVED LEFT. MEMO FILED VIDE USR NO.61120/24.,NAGARKURNOOL,
81,CRP/2463/2024IA,VIJAY B PAROPAKARI,,NAGARKURNOOL,
82,WP/2716/2024IA,SOMAVARAPU SATYANARAYANA,CHALAKANI VENKAT YADAVT P ACHARYA (R3)T P ACHARYA,MAHABUBNAGAR,
83,WP/9693/2024IA,G VASANTHA RAYUDU,GP FOR CIVIL SUPPLIES,NIRMAL,
84,WP/12411/2024IA,PRADEEP T,GP FOR CIVIL SUPPLIESPASHAM MOHITH (R6),SURYAPET,
85,WP/12505/2024IA,K RATHANGA PANI REDDY,GP FOR CIVIL SUPPLIESADDL ADVOCATE GENERAL (R2),WANAPARTHY,
86,WP/12865/2024IA,S DINESH,GP FOR CIVIL SUPPLIESG JAYAPRAKASH BABU (R9),KHAMMAM,
87,WP/19176/2024IA,K VENUMADHAV,GP FOR CIVIL SUPPLIES,PEDDAPALLI,
88,WP/20155/2024IA,SOMAVARAPU SATYANARAYANA,GP FOR CIVIL SUPPLIESGP FOR HOME (R6),MEDAK,
89,WP/20935/2024IA,K VENUMADHAV,GP FOR CIVIL SUPPLIESGP FOR HOME (R3),HYDERABAD,
90,WP/33253/2023IA,K BUCHI BABU,GP FOR COOPERATIONSRINIVAS  POLAVARAPU (R5)SRINIVAS  POLAVARAPU (R4)S SURENDER REDDY (R8)SRINIVAS  POLAVARAPU (R6)SRINIVAS  POLAVARAPU (R7),WARANGAL,
91,WP/35078/2023,T KISTAIAH,GP FOR COOPERATIONM VENKAT DIVAKAR (R4),RANGA REDDY,
92,WP/35132/2023IA,T KISTAIAH,GP FOR COOPERATIONM VENKAT DIVAKAR (R4),RANGA REDDY,
93,WP/1764/2024IA,T KISTAIAH,GP FOR COOPERATIONB A PRAKASH REDDY (R3)D Y L N CHARYULU,SURYAPET,
94,WP/16562/2024IA,A BHUVAN SUNDER REDDY,GP FOR COOPERATIONMALIPEDDI SRINIVAS REDDY (R3)P SUMITRA (R5),HYDERABAD,
95,WP/20870/2024IA,GIRIJA SHANKER SHARMA,GP FOR COOPERATION,MEDCHAL-MALKAJGIRI,
96,WP/21839/2024IA,B SHIVA KUMAR,MALIPEDDI SRINIVAS REDDYGP FOR COOPERATION (R2),MEDCHAL-MALKAJGIRI,
97,WP/2535/2024IA,BICHALA ARUNA,GANGULA ASHOK KUMAR REDDY (SC FORAPSTEP)GANGULA ASHOK KUMAR REDDY(SC FOR TS MARKFED) (R2),HYDERABAD,
98,WP/15559/2024IA,MD HABEEB ASHRAF,GP FOR AGRICULTUREC HARI PREETH (SC FOR TG AGRL M C) (R4)GP FOR MCPL ADMN URBAN DEV (R6),HYDERABAD,
99,WP/5488/2019IA,M V RAJ KUMAR GABRIEL,GP FOR REVENUEGP FOR PANCHAYAT RAJ   RURAL DEV (R4)R CHANDRA SHEKAR REDDY (SC FOR TS ZILLA PARISHADS) (R6),MEDAK,
100,WP/20730/2020IA,R R KALYAN,GP FOR PANCHAYAT RAJ   RURAL DEVGP FOR REVENUE (R2)P RAMA SHARANA SHARMA (R7)P RAMA SHARANA SHARMA (R6)P RAMA SHARANA SHARMA (R8)G NARENDER REDDY(SC FORTG ZPP MPP GPPS) (R5)LETTERS,KHAMMAM,
101,WP/13418/2020IA,P RAMA SHARANA SHARMA,GP FOR PANCHAYAT RAJ   RURAL DEVR R KALYANG NARENDER REDDY(SC FORTG ZPP MPP GPPS) (R2)G NARENDER REDDY(SC FORTG ZPP MPP GPPS) (R3),KHAMMAM,
102,WP/27355/2023IA,GANDYADAPU RAJESHAM,GP FOR PANCHAYAT RAJ   RURAL DEVKISHORE RAO PUSKURU (SC FOR TS ZILLA PARISHADS) (R5)THIMMARAJU RAMCHANDRA RAO,RAJANNA SIRCILLA,
103,WP/29158/2023IA,A PRABHAKAR RAO,GP FOR PANCHAYAT RAJ   RURAL DEVRAPOLU BHASKAR (R5)RAPOLU BHASKAR,MAHABUBABAD,
104,WP/34009/2023IA,GUMMALLA BHASKER REDDY,GP FOR PANCHAYAT RAJ   RURAL DEVGP FOR REVENUE (R2)D BHASKAR REDDY (R6)KISHORE RAO PUSKURU (SC FOR TS ZILLA PARISHADS) (R4)D BHASKAR REDDY (R5),PEDDAPALLI,
105,WP/34998/2023IA,S VIPLAV SIMHA REDDY,GP FOR REVENUEKISHORE RAO PUSKURU (SC FOR TS ZILLA PARISHADS) (R5)G RAVI CHANDRA SEKHAR (R6),KHAMMAM,
106,WP/3079/2024IA,C HANUMANTHA RAO,GP FOR PANCHAYAT RAJ   RURAL DEVGP FOR REVENUE (R2)D VAYU SEN (R12)BUCHI REDDY CHIMPULA (R15)D VAYU SEN (R13)GP FOR HOME (R6)GP FOR MCPL ADMN URBAN DEV (R3)V NARASIMHA GOUD(SC FOR HMDA) (R4)KISHORE RAO PUSKURU (SC FOR TS ZILLA PARISHADS) (R11)BUCHI REDDY CHIMPULA (R14),RANGA REDDY,
107,WP/10104/2024IA,BARLA MALLESH YADAV,GP FOR PANCHAYAT RAJ   RURAL DEVGP FOR REVENUE (R2),KARIMNAGAR,
108,WP/10129/2024IA,R R KALYAN,GP FOR PANCHAYAT RAJ   RURAL DEVGP FOR REVENUE (R2)MUMMANENI SRINIVASA RAO (R6),MULUGU,
109,WP/10826/2024IA,R R KALYAN,GP FOR PANCHAYAT RAJ   RURAL DEVGP FOR REVENUE (R2)KISHORE RAO PUSKURU (SC FOR TS ZILLA PARISHADS) (R5),BHADRADRI KOTHAGUDEM,
110,WP/11350/2024IA,JALAPALLI MADHAVI REDDY,GP FOR PANCHAYAT RAJ   RURAL DEVANIL KUMAR P (R7)R CHANDRA SHEKAR REDDY (SC FOR TS ZILLA PARISHADS) (R6),HYDERABAD,
111,WP/12849/2024IA,VENUGOPAL JULAKANTI,GP FOR PANCHAYAT RAJ   RURAL DEVGP FOR REVENUE (R2)PALLE SRIHARINATH (R6),SANGAREDDY,
112,WP/12954/2024IA,P BHANU PRAKASH,GP FOR PANCHAYAT RAJ   RURAL DEVAJAY KUMAR MADISETTY (R7)AJAY KUMAR MADISETTY (R9)GP FOR REVENUE (R3)AJAY KUMAR MADISETTY (R8),JANGAON,
113,WP/13063/2024IA,ENAMALLA NAGARAJU,GP FOR PANCHAYAT RAJ   RURAL DEVGP FOR REVENUE (R2)KISHORE RAO PUSKURU (SC FOR TS ZILLA PARISHADS) (R6),YADADRI BHUVANAGIRI,
114,WP/13109/2024IA,N MANOHAR,GP FOR PANCHAYAT RAJ   RURAL DEVGP FOR REVENUE (R2),SANGAREDDY,
115,WP/14988/2024IA,SUMITH RAJ,GP FOR PANCHAYAT RAJ   RURAL DEVGP FOR REVENUE (R2),SANGAREDDY,
116,WP/17679/2024IA,RAJASHEKAR THALLAPALLY,GP FOR PANCHAYAT RAJ   RURAL DEVKOLUKURI AKHIL REDDY (R10),MEDAK,
117,WP/18399/2024IA,Y VIJAYA BHASKER REDDY,GP FOR PANCHAYAT RAJ   RURAL DEV,SIDDIPET,
118,WP/21025/2024IA,YEMMIGANUR SOMA SRINATH REDDY,GP FOR PANCHAYAT RAJ   RURAL DEVGP FOR REVENUE (R2),RANGA REDDY,
119,WP/21119/2024IA,T V RAMANA RAO,GP FOR PANCHAYAT RAJ   RURAL DEV,RAJANNA SIRCILLA,
120,WP/21837/2024IA,KONDADI AJAY KUMAR,GP FOR PANCHAYAT RAJ   RURAL DEVGP FOR REVENUE (R2)R CHANDRA SHEKAR REDDY (SC FOR TS ZILLA PARISHADS) (R5),ADILABAD,
121,WP/12388/2024IA,GUDURU ASHOK REDDY,GADI PRAVEEN KUMAR Dy. SOLICITOR GEN. OF INDIAV DYUMANI (R2)chief note,HYDERABAD,
122,WP/12469/2024IA,GUDURU ASHOK REDDY,GADI PRAVEEN KUMAR Dy. SOLICITOR GEN. OF INDIAV DYUMANI (R2)chief note,HYDERABAD,
123,WP/13520/2024WP/33588/2022,MALLA REDDY GADIPALLY,GADI PRAVEEN KUMAR Dy. SOLICITOR GEN. OF INDIAGP FOR REVENUE (R4)GP FOR ROADS   BUILDINGS (R3)chief note,SIDDIPET,
124,WP/33588/2022IA,RAMESH BURA,B KAVITHA YADAV (CENTRAL GOVT COUNSEL)S S VARMA (SC FOR NHAI) (R2)GP FOR REVENUE (R3)GP FOR LAND ACQUISITION,SIDDIPET,
125,CC/1068/2020IA,M DAMODAR REDDY,"KANDI RAMCHANDRA REDDY (R1)G NARENDER REDDY(SC FORTG ZPP MPP GPPS) (R2)G NARENDER REDDY(SC FORTG ZPP MPP GPPS) (R3)KANDI RAMCHANDRA REDDY (R4)RR 1 TO 4 NOTICE SERVED.
 letters",MAHABUBNAGAR,
126,WP/20713/2020IA,M DAMODAR REDDY,GP FOR PANCHAYAT RAJ   RURAL DEVG NARENDER REDDY(SC FORTG ZPP MPP GPPS)G NARENDER REDDY(SC FORTG ZPP MPP GPPS) (R5),MAHABUBNAGAR,
127,WP/16488/2011,MOOSA AHMED,S BALACHANDER (R22),HYDERABAD,
128,WP/7661/2015IA,DANTU SRINIVAS,GP FOR COOPERATIONGADI PRAVEEN KUMAR Dy. SOLICITOR GEN. OF INDIA (R14)A NAGENDRA RAO (R13),HYDERABAD,
129,WP/20532/2015IA,NAZIR AHMED KHAN,GP FOR COOPERATIONMEHERCHAND NORI (R32),HYDERABAD,
130,WP/27381/2015IA,MOHAMMAD ADNAN,GP FOR PANCHAYAT RAJ   RURAL DEVG NARENDER REDDY(SC FORTG ZPP MPP GPPS) (R6)MOHD  GHULAM HUSSAIN (R4)MOHD  GHULAM HUSSAIN (R5)MOHD  GHULAM HUSSAIN,MEDAK,
131,WP/16360/2016IA,A SURESH,GP FOR PANCHAYAT RAJ   RURAL DEVP INDRA PRAKASH (R7),WARANGAL,
132,WP/1349/2017IA,RAPOLU BHASKAR,GP FOR PANCHAYAT RAJ   RURAL DEV,NALGONDA,
133,WP/9090/2017IA,J PRABHAKAR,GP FOR COOPERATIONSRINIVAS  POLAVARAPU (R3)C HARI PREETH (R9),WARANGAL,
134,WP/10817/2017IA,T KISTAIAH,M VENKAT DIVAKARGP FOR COOPERATION (R2),HYDERABAD,
135,WP/14772/2023IA,SOMAVARAPU SATYANARAYANA,GP FOR CIVIL SUPPLIESGP FOR HOME (R6),YADADRI BHUVANAGIRI,
136,WP/30601/2023IA,SOMAVARAPU SATYANARAYANA,GP FOR CIVIL SUPPLIESGP FOR HOME (R6),NIZAMABAD,
137,WP/15535/2018IA,A P SURESH RAM,GP FOR PANCHAYAT RAJ   RURAL DEVGP FOR REVENUE (R2)KISHORE RAO PUSKURU (SC FOR TS ZILLA PARISHADS) (R7),NALGONDA,
138,WP/13217/2022IA,P NAGENDRA REDDY,KISHORE RAO PUSKURU (SC FOR TS ZILLA PARISHADS),NALGONDA,
139,WP/22171/2022IA,P NAGENDRA REDDY,KISHORE RAO PUSKURU (SC FOR TS ZILLA PARISHADS)GP FOR PANCHAYAT RAJ   RURAL DEV (R2),WARANGAL,
140,WP/4612/2024,PULLA RAO YELLANKI,GP FOR PANCHAYAT RAJ   RURAL DEVKarnati Venkata Reddy (R6)KISHORE RAO PUSKURU (SC FOR TS ZILLA PARISHADS) (R4),SURYAPET,
141,WP/15970/2009IA,C VIKRAM CHANDRA,GP FOR PANCHAYAT RAJ   RURAL DEVK SRINIVASA MURTHY (R10),NALGONDA,
142,WP/28105/2009IA,K R PRABHAKAR,GP FOR COOPERATIONA H RAMA KRISHNA RAO (R5)B MAYUR REDDY (R7)K SRINIVASA MURTHY (R8)K RAGHUVEER REDDY (R9)SRINIVAS  POLAVARAPU (R6)SRINIVAS  POLAVARAPU,KARIMNAGAR,
143,WP/17152/2011IA,CH RAVINDRA BABU,GP FOR COOPERATIONM PAPA REDDY (R26),HYDERABAD,
144,WP/32358/2011,J PRABHAKAR,GP FOR AGRICULTURE,RANGA REDDY,
145,WP/659/2015IA,NANDIGAM KRISHNA RAO,GP FOR COOPERATION,NIZAMABAD,
146,WP/1124/2015IA,T BALA MOHAN REDDY,T SRUJAN KUMAR REDDYT DURGA REDDY (R9)D GNANESWARA NAIDU (R8),NIZAMABAD,
147,WP/5766/2015IA,KARAM CHENDU KOMIREDDY,GP FOR PANCHAYAT RAJ   RURAL DEVP V NARAYANA RAO (R9)P V SRINIVASA RAO (R10),KARIMNAGAR,
148,WP/42280/2022IA,GUDI MADHUSUDHAN REDDY,GP FOR PANCHAYAT RAJ   RURAL DEVKARAM CHENDU KOMIREDDY (R4)KISHORE RAO PUSKURU (SC FOR TS ZILLA PARISHADS) (R3),RAJANNA SIRCILLA,
149,WP/6276/2015IA,V HARI HARAN,GP FOR COOPERATIONM VENKAT DIVAKAR (R15),HYDERABAD,
150,WP/19741/2015IA,M VENKAT DIVAKAR,GP FOR COOPERATIONRAVIKANTH KHAMMAMETTU (R12),NALGONDA,
151,WP/41549/2015IA,K S MURTHY,GP FOR AGRICULTUREGP FOR REVENUE (R24),MEDAK,
152,WP/13804/2016IA,N ASHOK KUMAR,GP FOR PANCHAYAT RAJ   RURAL DEVT  V LAXMIKANTHAM (R5)G NARENDER REDDY(SC FORTG ZPP MPP GPPS) (R12),NIZAMABAD,
153,WP/11655/2016,M V L NARSAIAH,GP FOR PANCHAYAT RAJ   RURAL DEVG NARENDER REDDY(SC FORTG ZPP MPP GPPS) (R24),NIZAMABAD,
154,WP/30487/2016IA,K K MAHENDER REDDY PERI PRABHAKAR,GP FOR COOPERATION,HYDERABAD,
155,WP/34100/2016IA,B RACHNA,GP FOR PANCHAYAT RAJ   RURAL DEVGP FOR REVENUE (R3),MEDAK,
156,WP/308/2017IA,VIKRAM POOSERLA,GP FOR COOPERATIONM VENKAT DIVAKAR (R5),HYDERABAD,
157,CC/558/2017WP/2085/2017,K S MURTHY,GP FOR PANCHAYAT RAJ   RURAL DEV,KARIMNAGAR,
158,WP/2085/2017IA,K S MURTHY,GP FOR PANCHAYAT RAJ   RURAL DEVGP FOR HOME (R81)GP FOR REVENUE (R78)N PRAVEEN KUMAR(SC FOR MC TELANGANA) (R79),KARIMNAGAR,
159,WP/978/2017IA,PALLE SRIHARINATH,GP FOR PANCHAYAT RAJ   RURAL DEVGP FOR ROADS   BUILDINGS (R21),MEDAK,
160,WP/1639/2017IA,K VENUMADHAV,GP FOR PANCHAYAT RAJ   RURAL DEV (R66)G NARENDER REDDY(SC FORTG ZPP MPP GPPS) (R67),KARIMNAGAR,
161,WP/1660/2017IA,VENUGOPAL JULAKANTI,GP FOR AGRICULTURE,WARANGAL,
162,WP/15459/2018IA,T SURYA SATISH,GP FOR PANCHAYAT RAJ   RURAL DEVN KRISHNA SUMANTH (R6)K UDAYA SRI (R7)GP FOR ROADS   BUILDINGS (R8)G NARENDER REDDY(SC FORTG ZPP MPP GPPS) (R3),NALGONDA,
163,WP/32444/2016IA,T SURYA SATISH,GP FOR CIVIL SUPPLIESK UDAYA SRI (R1)N KRISHNA SUMANTHGP FOR HOME (R21)GP FOR ROADS   BUILDINGS (R23)GP FOR PANCHAYAT RAJ   RURAL DEVN KRISHNA SUMANTH (R22)GP FOR REVENUE (R20)GP FOR PANCHAYAT RAJ   RURAL DEV (R24),NALGONDA,
164,WP/39792/2022IA,R LAXMINARASIMHA RAO,GP FOR CIVIL SUPPLIES,KARIMNAGAR,
165,WP/25486/2023IA,KALVALA SANJEEV,GP FOR CIVIL SUPPLIES,NARAYANPET,NIC-TSHC Computer Cell
165,WP/25486/2023IA,KALVALA SANJEEV,GP FOR CIVIL SUPPLIES,NARAYANPET,
NIC-TSHC Computer Cell,,,,,
